{
  "$schema": "http://json-schema.org/draft-07/schema#",
  "$id": "schema/ads.schema.json",
  "title": "Ad placements",
  "description": "Shape contract for shared/data/ads.json. Generated by tools/studio/gen-schemas.mjs — edit the generator, not this file.",
  "type": "object",
  "required": [
    "androidAppId",
    "antiFraud",
    "consent",
    "interstitial",
    "iosAppId",
    "mediation",
    "rewardedPlacements",
    "units",
    "version"
  ],
  "additionalProperties": false,
  "properties": {
    "$schema": {
      "type": "string"
    },
    "_comment": {
      "type": "string"
    },
    "androidAppId": {
      "type": "object",
      "properties": {
        "debug": {
          "type": "string"
        },
        "release": {
          "type": "string"
        }
      },
      "required": [
        "debug",
        "release"
      ]
    },
    "antiFraud": {
      "type": "object",
      "properties": {
        "logRewardMismatch": {
          "type": "boolean"
        },
        "maxConcurrentRewardCallbacks": {
          "type": "integer"
        },
        "rewardTokenSingleUse": {
          "type": "boolean"
        },
        "tokenTtlSec": {
          "type": "integer"
        }
      },
      "required": [
        "logRewardMismatch",
        "maxConcurrentRewardCallbacks",
        "rewardTokenSingleUse",
        "tokenTtlSec"
      ]
    },
    "consent": {
      "type": "object",
      "properties": {
        "blockingFirstFrame": {
          "type": "boolean"
        },
        "childDirected": {
          "type": "boolean"
        },
        "framework": {
          "type": "string"
        },
        "regions": {
          "type": "object",
          "properties": {
            "brazil": {
              "type": "string"
            },
            "eeaUk": {
              "type": "string"
            },
            "other": {
              "type": "string"
            }
          },
          "required": [
            "brazil",
            "eeaUk",
            "other"
          ]
        },
        "requestOnFirstLaunch": {
          "type": "boolean"
        }
      },
      "required": [
        "blockingFirstFrame",
        "childDirected",
        "framework",
        "regions",
        "requestOnFirstLaunch"
      ]
    },
    "interstitial": {
      "type": "object",
      "properties": {
        "enabled": {
          "type": "boolean"
        },
        "maxPerDay": {
          "type": "integer"
        },
        "maxPerSession": {
          "type": "integer"
        },
        "minSecondsBetween": {
          "type": "integer"
        },
        "placement": {
          "type": "string"
        },
        "showProbability": {
          "type": "number"
        },
        "skipFirstSessions": {
          "type": "integer"
        },
        "skipFirstTurns": {
          "type": "integer"
        },
        "suppressAfterIapHours": {
          "type": "integer"
        },
        "suppressAfterRewardedMin": {
          "type": "integer"
        },
        "suppressDuring": {
          "type": "array",
          "items": {
            "enum": [
              "active_order",
              "cooking",
              "critical_action",
              "tutorial"
            ]
          }
        }
      },
      "required": [
        "enabled",
        "maxPerDay",
        "maxPerSession",
        "minSecondsBetween",
        "placement",
        "showProbability",
        "skipFirstSessions",
        "skipFirstTurns",
        "suppressAfterIapHours",
        "suppressAfterRewardedMin",
        "suppressDuring"
      ]
    },
    "iosAppId": {
      "type": "object",
      "properties": {
        "debug": {
          "type": "string"
        },
        "release": {
          "type": "string"
        }
      },
      "required": [
        "debug",
        "release"
      ]
    },
    "mediation": {
      "type": "object",
      "properties": {
        "biddingReady": {
          "type": "boolean"
        },
        "futureNetworks": {
          "type": "array",
          "items": {
            "type": "string"
          }
        },
        "initializationStrategy": {
          "type": "string"
        },
        "neverBlockFirstFrame": {
          "type": "boolean"
        },
        "provider": {
          "type": "string"
        },
        "sdk": {
          "type": "string"
        }
      },
      "required": [
        "biddingReady",
        "futureNetworks",
        "initializationStrategy",
        "neverBlockFirstFrame",
        "provider",
        "sdk"
      ]
    },
    "rewardedPlacements": {
      "type": "array",
      "items": {
        "type": "object",
        "properties": {
          "analytics": {
            "type": "string"
          },
          "context": {
            "type": "string"
          },
          "cooldownMin": {
            "type": "integer"
          },
          "id": {
            "type": "string",
            "pattern": "^[a-z][a-z0-9_]*$"
          },
          "maxPerDay": {
            "type": "integer"
          }
        },
        "required": [
          "analytics",
          "context",
          "cooldownMin",
          "id",
          "maxPerDay"
        ]
      }
    },
    "units": {
      "type": "object",
      "properties": {
        "banner": {
          "type": "object",
          "properties": {
            "enabled": {
              "type": "boolean"
            },
            "note": {
              "type": "string"
            }
          },
          "required": [
            "enabled",
            "note"
          ]
        },
        "interstitial": {
          "type": "object",
          "properties": {
            "debug": {
              "type": "string"
            },
            "preload": {
              "type": "boolean"
            },
            "release": {
              "type": "string"
            }
          },
          "required": [
            "debug",
            "preload",
            "release"
          ]
        },
        "rewarded": {
          "type": "object",
          "properties": {
            "debug": {
              "type": "string"
            },
            "preload": {
              "type": "boolean"
            },
            "release": {
              "type": "string"
            },
            "serverSideVerification": {
              "type": "object",
              "properties": {
                "enabled": {
                  "type": "boolean"
                },
                "note": {
                  "type": "string"
                }
              },
              "required": [
                "enabled",
                "note"
              ]
            }
          },
          "required": [
            "debug",
            "preload",
            "release",
            "serverSideVerification"
          ]
        }
      },
      "required": [
        "banner",
        "interstitial",
        "rewarded"
      ]
    },
    "version": {
      "type": "integer"
    }
  }
}
